title,title_original,merged_titles,n_entries_merged,synopsis,genres,themes,score,episodes,aired,studios,composer,composer_source_url,features,mood,mood_method,imdb_review_url,artwork,mal_id,mal_url,artwork_url,mal_title_matched,mal_match_score
Ginga Eiyuu Densetsu,Ginga Eiyuu Densetsu,Ginga Eiyuu Densetsu | Ginga Eiyuu Densetsu: Die Neue These - Gekitotsu | Ginga Eiyuu Densetsu: Die Neue These - Sakubou | Ginga Eiyuu Densetsu: Die Neue These - Seiran 2 | Ginga Eiyuu Densetsu: Die Neue These - Seiran 3,5,"The 150-year-long stalemate between the two interstellar superpowers, the Galactic Empire and the Free Planets Alliance, comes to an end when a new generation of leaders arises: the idealistic military genius Reinhard von Lohengramm, and the FPA's reserved historian, Yang Wenli.

While Reinhard climbs the ranks of the Empire with the aid of his childhood friend, Siegfried Kircheis, he must fight not only the war, but also the remnants of the crumbling Goldenbaum Dynasty in order to free his sister from the Kaiser and unify humanity under one genuine ruler. Meanwhile, on the other side of the galaxy, Yang—a strong supporter of democratic ideals—has to stand firm in his beliefs, despite the struggles of the FPA, and show his pupil, Julian Mintz, that autocracy is not the solution.

As ideologies clash amidst the war's many casualties, the two strategic masterminds must ask themselves what the real reason behind their battle is.

[Written by MAL Rewrite]",Drama | Sci-Fi,Adult Cast | Military | Space,9.01,110,1988,K-Factory | Kitty Film Mitaka Studio,VEB Deutsche Schallplatten,,,"slow-burn, cerebral political space opera; realistic and patient storytelling",IMDb user reviews (snippet synth),https://www.imdb.com/title/tt0096633/reviews/,https://www.google.com/search?tbm=isch&q=Ginga+Eiyuu+Densetsu+anime+official+key+visual,820,https://myanimelist.net/anime/820/Ginga_Eiyuu_Densetsu,https://cdn.myanimelist.net/images/anime/1976/142016l.jpg,Ginga Eiyuu Densetsu,1
Gintama,Gintama°,Gintama | Gintama Movie 1: Shinyaku Benizakura-hen | Gintama Movie 2: Kanketsu-hen - Yorozuya yo Eien Nare | Gintama' | Gintama': Enchousen | Gintama. | Gintama. Porori-hen | Gintama. Shirogane no Tamashii-hen | Gintama. Shirogane no Tamashii-hen - Kouhan-sen | Gintama: Shinyaku Benizakura-hen | Gintama: Shiroyasha Koutan | Gintama: The Final | Gintama: The Semi-Final | Gintama: Yorinuki Gintama-san on Theater 2D | Gintama° | Gintama°: Aizome Kaori-hen,16,"Gintoki, Shinpachi, and Kagura return as the fun-loving but broke members of the Yorozuya team! Living in an alternate-reality Edo, where swords are prohibited and alien overlords have conquered Japan, they try to thrive on doing whatever work they can get their hands on. However, Shinpachi and Kagura still haven't been paid... Does Gin-chan really spend all that cash playing pachinko?

Meanwhile, when Gintoki drunkenly staggers home one night, an alien spaceship crashes nearby. A fatally injured crew member emerges from the ship and gives Gintoki a strange, clock-shaped device, warning him that it is incredibly powerful and must be safeguarded. Mistaking it for his alarm clock, Gintoki proceeds to smash the device the next morning and suddenly discovers that the world outside his apartment has come to a standstill. With Kagura and Shinpachi at his side, he sets off to get the device fixed; though, as usual, nothing is ever that simple for the Yorozuya team.

Filled with tongue-in-cheek humor and moments of heartfelt emotion, Gintama's fourth season finds Gintoki and his friends facing both their most hilarious misadventures and most dangerous crises yet.

[Written by MAL Rewrite]",Action | Comedy | Sci-Fi,Gag Humor | Historical | Parody | Samurai,9.05,51,2015,Bandai Namco Pictures,Audio Highs,,,chaotic comedy that flips into epic fights and surprisingly heartfelt moments,IMDb user reviews (snippet synth),https://www.imdb.com/title/tt0988818/reviews/,https://www.google.com/search?tbm=isch&q=Gintama+anime+official+key+visual,918,https://myanimelist.net/anime/918/Gintama,https://cdn.myanimelist.net/images/anime/10/73274l.jpg,Gintama,1
Girls & Panzer: Saishuushou,Girls & Panzer: Saishuushou Part 4,Girls & Panzer Movie | Girls & Panzer: Saishuushou Part 4,2,"The Winter Continuous Track Cup semifinals are underway and Ooarai Girls’ Academy find themselves in deep trouble early in their match against Continuation High School. The Anglerfish Team are knocked out by Continuation's sharpshooter, forcing the rest of the team to use a different game plan. Stepping up in the absence of her star teammates, Azusa Sawa shows her leadership potential by temporarily taking over as Ooarai's commander. However, the match proves that it will take more than a new strategy for Ooarai to survive this time around.

On the other side of the tournament, Kuromorimine Girls' Academy and St. Gloriana Girls' College are locked in a fiery desert battle. Having developed her own unorthodox tactical style, Erika Itsumi rallies Kuromorimine from the brink of defeat into a fierce showdown against their opponent's veteran commander, Darjeeling. But St. Gloriana have bolstered their ranks with a familiar face who recently transferred to their school, hampering Kuromorimine's quest for victory.

The championship round is within striking distance for these four schools, but only two will have what it takes to move on!

[Written by MAL Rewrite]",,CGDCT | Military | School,8.36,1,2023,Actas,Shiro Hamaguchi,,,Ridiculous and delightful—absurd tank battles played with pure joy; fans praise its escalating creativity.,IMDb user reviews (snippet synth),,https://www.google.com/search?tbm=isch&q=Girls+%26+Panzer%3A+Saishuushou+anime+official+key+visual,39167,https://myanimelist.net/anime/39167/Girls___Panzer__Saishuushou_Part_4,https://cdn.myanimelist.net/images/anime/1652/138188l.jpg,Girls & Panzer: Saishuushou Part 4,0.8852
Girls Band Cry,Girls Band Cry,Girls Band Cry,1,"Everyone yearns to find their true purpose in life. This is also true for Nina Iseri, a 17-year-old girl looking to enroll in a good university, but the world always seems to work against her. On her very first day in Tokyo, she gets lost, ignored, and locked out of her new apartment. However, an unexpected opportunity arises when Nina meets Momoka Kawaragi, one of her favorite guitarists.

After Nina joins Momoka for a street performance, Momoka decides they should start a band together. While Nina initially hesitates, her determination grows as they start acquiring more bandmates—the beautiful drummer Subaru Awa, the aloof keyboardist Tomo Ebizuka, and the intelligent bassist Rupa. The five girls face challenges both in the music industry and within themselves, but their shared passion for music never lets them give up on their dreams.

[Written by MAL Rewrite]",Drama,Music,8.38,13,2024,Toei Animation,Kenji Tamai,,,Raw and earnest—a scrappy underdog band story with rough edges that feel like genuine emotional honesty.,IMDb user reviews (snippet synth),,https://www.google.com/search?tbm=isch&q=Girls+Band+Cry+anime+official+key+visual,55102,https://myanimelist.net/anime/55102/Girls_Band_Cry,https://cdn.myanimelist.net/images/anime/1711/140515l.jpg,Girls Band Cry,1
Given Movie 3: Umi e,Given Movie 3: Umi e,Given | Given Movie 3: Umi e,2,Second part of Given Movie: Hiiragi Mix.,Boys Love | Drama,Music,8.4,1,2024,Lerche,Michiru,,,Quietly emotional—a bittersweet chapter in a beloved music romance; intimate and emotionally delicate.,IMDb user reviews (snippet synth),,https://www.google.com/search?tbm=isch&q=Given+Movie+3%3A+Umi+e+anime+official+key+visual,58222,https://myanimelist.net/anime/58222/Given_Movie_3__Umi_e,https://cdn.myanimelist.net/images/anime/1663/144261l.jpg,Given Movie 3: Umi e,1
Golden Kamuy,Golden Kamuy 3rd Season,Golden Kamuy 3rd Season,1,"After obtaining information about Asirpa from the foreteller Inkarmat, Saichi ""The Immortal"" Sugimoto, Genjirou Tanigaki, and Cikapasi join the Seventh Division's Otonoshin Koito and Hajime Tsukishima on a journey to Karafuto. Heading further north into the freezing Russian territory, they collect any clues about Asirpa's whereabouts they can find and rush after her.

Meanwhile, Asirpa is unaware of what truly transpired at Abashiri Prison. Deeply disturbed and confused by her father Wilk's past actions, Asirpa follows his old friend Kiroranke to the place where Wilk was born and raised in order to better understand his motives. However, Kiroranke and the master sniper Hyakunosuke Ogata are scheming behind her back.

Even if they were to obtain all 24 tattooed skins that form a map to the lost Ainu gold, the various factions searching for it now understand that the map is useless without Asirpa. Realizing the danger she could be in, Sugimoto desperately hopes to reach Asirpa first and protect her from the greedy clutches of those who plan to drag her into their sins.

[Written by MAL Rewrite]",Action | Adventure,Adult Cast | Historical | Military,8.43,12,2020,Geno Studio,Kenichiro Suehiro,,,Thrilling and darkly funny—a wild historical adventure with unforgettable characters and surprising tonal range.,IMDb user reviews (snippet synth),,https://www.google.com/search?tbm=isch&q=Golden+Kamuy+anime+official+key+visual,36028,https://myanimelist.net/anime/36028/Golden_Kamuy,https://cdn.myanimelist.net/images/anime/1145/90880l.jpg,Golden Kamuy,1
Gotcha!,Gotcha!,Gotcha!,1,"In a bright, grandiose city, a young boy and girl look for their partners amidst a technicolor tour de force. As the two embark on their respective quests, they encounter the familiar faces of those who have made their mark on the Pokémon world. Villains, champions, rivals, and professors alike grace the tallest skyscrapers and largest screens while the adventurous teens carry on in the search for their companions.

Gotcha! takes its viewers on a nostalgic trip to the riveting realm of Pokémon, encapsulating the electrifying essence of the franchise.

[Written by MAL Rewrite]",Fantasy,Music,8.31,1,2020,Bones,Masayoshi Soken,,,Vibrant and jubilant—a spectacular musical celebration packed with Final Fantasy history and pure fan joy.,IMDb user reviews (snippet synth),,https://www.google.com/search?tbm=isch&q=Gotcha%21+anime+official+key+visual,42984,https://myanimelist.net/anime/42984/Gotcha,https://cdn.myanimelist.net/images/anime/1637/109512l.jpg,Gotcha!,1
Grand Blue,Grand Blue,Grand Blue,1,"Iori Kitahara moves to the coastal town of Izu for his freshman year at its university, taking residence above Grand Blue, his uncle's scuba diving shop. Iori has high hopes and dreams about having the ideal college experience, but when he enters the shop he is sucked into the alcoholic activities of the carefree members of the Diving Club who frequent the place. Persuaded by upperclassmen Shinji Tokita and Ryuujirou Kotobuki, Iori reluctantly joins their bizarre party. His cousin Chisa Kotegawa later walks in and catches him in the act, earning Iori her utter disdain.

Based on Kenji Inoue and Kimitake Yoshioka's popular comedy manga, Grand Blue follows Iori's misadventures with his eccentric new friends as he strives to realize his ideal college dream, while also learning how to scuba dive.

[Written by MAL Rewrite]",Comedy,Adult Cast | Gag Humor,8.44,12,2018,Zero-G,"Manual of Errors (, S1, ), Yukari Hashimoto,  (, S2, )",,,"Outrageously funny—diving club chaos driven by absurdist drinking humor; reviewers highlight its relentless, ridiculous energy.",IMDb user reviews (snippet synth),,https://www.google.com/search?tbm=isch&q=Grand+Blue+anime+official+key+visual,37105,https://myanimelist.net/anime/37105/Grand_Blue,https://cdn.myanimelist.net/images/anime/1302/94882l.jpg,Grand Blue,1
Great Pretender,Great Pretender,Great Pretender,1,"A series of unfortunate events has led Makoto Edamura to adopt the life of crime—pickpocketing and scamming others for a living. However, after swindling a seemingly clueless tourist, Makoto discovers that he was the one tricked and, to make matters worse, that the police are now after him. 

While making his escape, he runs into the tourist once again, who turns out to be a fellow con man named Laurent Thierry, and ends up following him to Los Angeles. In an attempt to defend his self-proclaimed title of ""Japan's Greatest Swindler,"" Makoto challenges his rival to determine the better scammer. Accepting the competition, Laurent drops them off outside a huge mansion and claims that their target will be the biggest mafia boss on the West Coast.

As Makoto becomes increasingly involved with the cunning Laurent, his colorful associates, and the world of international high-stakes fraud, he soon realizes that he got more than what he bargained for as his self-declared skills are continually put to the test.

[Written by MAL Rewrite]",Action | Adventure | Mystery,Adult Cast | Organized Crime,8.2,23,2020,Wit Studio,Yutaka Yamada,,,Slick and stylish—a globe-trotting con artist thriller with sharp twists and genuine emotional payoffs.,IMDb user reviews (snippet synth),,https://www.google.com/search?tbm=isch&q=Great+Pretender+anime+official+key+visual,40052,https://myanimelist.net/anime/40052/Great_Pretender,https://cdn.myanimelist.net/images/anime/1418/107954l.jpg,Great Pretender,1
Great Teacher Onizuka,Great Teacher Onizuka,Great Teacher Onizuka,1,"Twenty-two-year-old Eikichi Onizuka—ex-biker gang leader, conqueror of Shonan, and virgin—has a dream: to become the greatest high school teacher in all of Japan. This isn't because of a passion for teaching, but because he wants a loving teenage wife when he's old and gray. Still, for a perverted, greedy, and lazy delinquent, there is more to Onizuka than meets the eye. So when he lands a job as the homeroom teacher of the Class 3-4 at the prestigious Holy Forest Academy—despite suplexing the Vice Principal—all of his talents are put to the test, as this class is particularly infamous.

Due to their utter contempt for all teachers, the class' students use psychological warfare to mentally break any new homeroom teacher they get, forcing them to quit and leave school. However, Onizuka isn't your average teacher, and he's ready for any challenge in his way.

Bullying, suicide, and sexual harassment are just a few of the issues his students face daily. By tackling the roots of their problems, Onizuka supports them with his unpredictable and unconventional methods—even if it means jumping off a building to save a suicidal child. Thanks to his eccentric charm and fun-loving nature, Class 3-4 slowly learns just how enjoyable school can be when you're the pupils of the Great Teacher Onizuka.

[Written by MAL Rewrite]",Comedy,Delinquents | School | Workplace,8.68,43,1999,Pierrot,Yusuke Honma,,,Raucous and surprisingly touching—a delinquent-turned-teacher story that balances hilarious chaos with real warmth.,IMDb user reviews (snippet synth),,https://www.google.com/search?tbm=isch&q=Great+Teacher+Onizuka+anime+official+key+visual,245,https://myanimelist.net/anime/245/Great_Teacher_Onizuka,https://cdn.myanimelist.net/images/anime/13/11460l.jpg,Great Teacher Onizuka,1
Gyakkyou Burai Kaiji: Ultimate Survivor,Gyakkyou Burai Kaiji: Ultimate Survivor,Gyakkyou Burai Kaiji: Hakairoku-hen | Gyakkyou Burai Kaiji: Ultimate Survivor,2,"After one of his coworkers fails to repay a debt, apathetic bum Kaiji Itou is pressured by loan sharks to settle the large sum of cash. Since Kaiji has little money and no future prospects of his own, he is unable to return what his colleague borrowed. Faced with massive financial burdens, Kaiji is given an offer to board the illustrious Espoir—it is said that ""one night aboard the ship, and all of your debts will be paid.""

What seems like a simple night of gambling quickly turns into a game of strategy and betrayal. With the losers of the tournament being subjected to a backbreaking life of indebted servitude, Kaiji must choose his actions—and allies—carefully. However, this is only the beginning of a series of gambles that will wager Kaiji's life, testing the full extent of his wits and will to survive.

[Written by MAL Rewrite]",Suspense,Adult Cast | High Stakes Game | Psychological | Strategy Game,8.26,26,2007,Madhouse,Hideki Taniuchi,,,"Nerve-shredding and brilliant—psychological gambling drama with suffocating tension and a desperate, unforgettable protagonist.",IMDb user reviews (snippet synth),,https://www.google.com/search?tbm=isch&q=Gyakkyou+Burai+Kaiji%3A+Ultimate+Survivor+anime+official+key+visual,3002,https://myanimelist.net/anime/3002/Gyakkyou_Burai_Kaiji__Ultimate_Survivor,https://cdn.myanimelist.net/images/anime/12/80032l.jpg,Gyakkyou Burai Kaiji: Ultimate Survivor,1
Hachimitsu to Clover,Hachimitsu to Clover II,Hachimitsu to Clover II,1,"Back from his journey across Japan, Yuuta Takemoto reminisces about his college life so far. He has matured significantly since his second year and is motivated to move forward.

Feeling more confident than ever before, he finally confesses to Hagumi Hanamoto, the girl he has been in love with since their first encounter. However, Hagumi has been confused by her attempts to understand the mysterious Shinobu Morita. Hiding behind a playful demeanor, Morita may be the most burdened by his own potential. Meanwhile, Takumi Mayama has become a full-fledged working adult and has landed Ayumi Yamada several pottery orders through his company in an act of friendship.

The five youths continue to face individual hardships in academics, work, love, and friendship as they push each other toward the paths that they are destined to walk.

[Written by MAL Rewrite]",Drama | Romance,Adult Cast | Love Polygon | Visual Arts,8.18,12,2006,J.C.Staff,"Yuzo Hayashi,  [, ja, ]",,,"Achingly bittersweet—an art school romance praised for its honest, painful portrayal of unrequited love.",IMDb user reviews (snippet synth),,https://www.google.com/search?tbm=isch&q=Hachimitsu+to+Clover+anime+official+key+visual,16,https://myanimelist.net/anime/16/Hachimitsu_to_Clover,https://cdn.myanimelist.net/images/anime/1301/133577l.jpg,Hachimitsu to Clover,1
Haikyu!!,Haikyuu!! Karasuno Koukou vs. Shiratorizawa Gakuen Koukou,Haikyuu!! Karasuno Koukou vs. Shiratorizawa Gakuen Koukou,1,"After the victory against Aoba Jousai High, Karasuno High School, once called “a fallen powerhouse, a crow that can’t fly,” has finally reached the climax of the heated Spring tournament. Now, to advance to nationals, the Karasuno team has to defeat the powerhouse Shiratorizawa Academy. Karasuno’s greatest hurdle is their adversary’s ace, Wakatoshi Ushijima, the number one player in the Miyagi Prefecture, and one of the country’s top three aces.

Only the strongest team will make it to the national tournament. Since this match is the third-year players’ last chance to qualify for nationals, Karasuno has to use everything they learned during the training camp and prior matches to attain victory. Filled with restlessness and excitement, both teams are determined to come out on top in the third season of Haikyuu!!.

[Written by MAL Rewrite]",Sports,School | Team Sports,8.77,10,2016,Production I.G,Yuki Hayashi; Asami Tachibana,https://haikyuu.fandom.com/wiki/TV_Anime_%22Haiky%C5%AB%21%21_Karasuno_High_School_VS_Shiratorizawa_Academy%22_Original_Soundtrack,,adrenaline-pumping and inspiring; heartfelt teamwork vibes with big emotional peaks,IMDb user reviews (snippet synth),https://www.imdb.com/title/tt3398540/reviews/,https://www.google.com/search?tbm=isch&q=Haikyu%21%21+anime+official+key+visual,20583,https://myanimelist.net/anime/20583/Haikyuu,https://cdn.myanimelist.net/images/anime/7/76014l.jpg,Haikyuu!!,0.9412
Haikyuu!! Movie: Gomisuteba no Kessen,Haikyuu!! Movie: Gomisuteba no Kessen,Haikyuu!! Movie 3: Sainou to Sense | Haikyuu!! Movie 4: Concept no Tatakai | Haikyuu!! Movie: Gomisuteba no Kessen,3,"Kenma Kozume has never considered volleyball fun or thrilling: it is merely something he is good at. But now Nekoma High School's volleyball team has qualified for the Spring Nationals and prepares to battle their long-standing rivals—Karasuno. Now, Kenma has to analyze the most confounding and resilient team and lead Nekoma to victory against them. Moreover, he will play against his friend Shouyou Hinata, Karasuno's short but incredibly proficient middle blocker.

Karasuno has never been able to beat Nekoma in practice matches. Even so, despite his usual indifference, Kenma feels a tinge of excitement at the prospect of facing Karasuno in a high-stakes official game with no do-overs. To advance to the semifinals and ultimately restore their team's former glory, Karasuno must find a way to overcome Kenma's brilliant strategy and defeat Nekoma in their own territory.

[Written by MAL Rewrite]",Sports,School | Team Sports,8.61,1,2024,Production I.G,"Yuki Hayashi, Asami Tachibana",,,Euphoric and emotionally cathartic—a theatrical finale delivering maximum tension and overwhelming emotional release.,IMDb user reviews (snippet synth),,https://www.google.com/search?tbm=isch&q=Haikyuu%21%21+Movie%3A+Gomisuteba+no+Kessen+anime+official+key+visual,52742,https://myanimelist.net/anime/52742/Haikyuu_Movie__Gomisuteba_no_Kessen,https://cdn.myanimelist.net/images/anime/1665/140360l.jpg,Haikyuu!! Movie: Gomisuteba no Kessen,1
Haikyuu!! Second Season,Haikyuu!! Second Season,Haikyuu!! Second Season,1,"Following their participation at the Inter-High, the Karasuno High School volleyball team attempts to refocus their efforts, aiming to conquer the Spring tournament instead. 

When they receive an invitation from long-standing rival Nekoma High, Karasuno agrees to take part in a large training camp alongside many notable volleyball teams in Tokyo and even some national level players. By playing with some of the toughest teams in Japan, they hope not only to sharpen their skills, but also come up with new attacks that would strengthen them. Moreover, Hinata and Kageyama attempt to devise a more powerful weapon, one that could possibly break the sturdiest of blocks. 

Facing what may be their last chance at victory before the senior players graduate, the members of Karasuno's volleyball team must learn to settle their differences and train harder than ever if they hope to overcome formidable opponents old and new—including their archrival Aoba Jousai and its world-class setter Tooru Oikawa.

[Written by MAL Rewrite]",Sports,School | Team Sports,8.62,25,2015,Production I.G,Yuki Hayashi,,,Intense and inspiring—the training arc and tournament run build to genuine emotional peaks; deeply satisfying sports drama.,IMDb user reviews (snippet synth),,https://www.google.com/search?tbm=isch&q=Haikyuu%21%21+Second+Season+anime+official+key+visual,28891,https://myanimelist.net/anime/28891/Haikyuu_Second_Season,https://cdn.myanimelist.net/images/anime/9/76662l.jpg,Haikyuu!! Second Season,1
Haikyuu!! To the Top,Haikyuu!! To the Top Part 2,Haikyuu!! To the Top Part 2,1,"Once called a fallen powerhouse and known as ""Flightless Crows,"" Karasuno High School has finally taken flight at nationals. With a comprehensive performance against Tsubakihara Academy in their first match, the team is now facing its toughest opponent yet: the runners-up of the last Spring Tournament, Inarizaki High School. Furthermore, dealing with the formidable twin Miya brothers only makes things more difficult for Karasuno.

As soon as the match begins, Karasuno is overwhelmed by all the noise and jeers from the supporters of Inarizaki High but rekindles its strength thanks to its own loyal fans. Karasuno also gains some momentum by utilizing an attack centered on Shouyou Hinata, but the eccentric play of Atsumu and Osamu Miya delivers an unexpected blow that leaves their opponent astounded.

Things are bound to get intense as the match progresses between these two teams. Will Karasuno be able to defeat Inarizaki High and overcome the hurdles that threaten its pursuit to the top?

[Written by MAL Rewrite]",Sports,School | Team Sports,8.55,12,2020,Production I.G,"Yuki Hayashi, Asami Tachibana",,,Gripping and triumphant—delivers some of the series' most intense matches with soaring emotional momentum.,IMDb user reviews (snippet synth),,https://www.google.com/search?tbm=isch&q=Haikyuu%21%21+To+the+Top+anime+official+key+visual,38883,https://myanimelist.net/anime/38883/Haikyuu_To_the_Top,https://cdn.myanimelist.net/images/anime/1813/105367l.jpg,Haikyuu!! To the Top,1
