title,title_original,merged_titles,n_entries_merged,synopsis,genres,themes,score,episodes,aired,studios,composer,composer_source_url,features,mood,mood_method,imdb_review_url,artwork,mal_id,mal_url,artwork_url,mal_title_matched,mal_match_score
"Shinseiki Evangelion Movie: Air/Magokoro wo, Kimi ni","Shinseiki Evangelion Movie: Air/Magokoro wo, Kimi ni","Shinseiki Evangelion | Shinseiki Evangelion Movie: Air/Magokoro wo, Kimi ni",2,"Shinji Ikari is left emotionally comatose after the death of a dear friend. With his son mentally unable to pilot the humanoid robot Evangelion Unit-01, Gendou Ikari's NERV races against the shadow organization SEELE to see who can enact their ultimate plan first. SEELE desires to create a godlike being by fusing their own souls into an Evangelion unit, while Gendou wishes to revert all of humanity into one primordial being so that he can be reunited with Yui, his deceased wife.

SEELE unleashes its military forces in a lethal invasion of NERV headquarters. As SEELE's forces cut down NERV's scientists and security personnel, Asuka Langley Souryuu pilots Evangelion Unit-02 in a desperate last stand against SEELE's heaviest weaponry.

The battle rages on, and a depressed Shinji hides deep within NERV's headquarters. With the fate of the world resting in Shinji's hands, Captain Misato Katsuragi hunts for the teenage boy as society crumbles around them.

[Written by MAL Rewrite]",Action | Avant Garde | Drama | Sci-Fi | Suspense,Mecha | Psychological,8.56,1,1997,Gainax | Production I.G,Shirō Sagisu,,,Deeply challenging and unforgettable—a psychological deconstruction that remains one of animation's most divisive and discussed works.,IMDb user reviews (snippet synth),,https://www.google.com/search?tbm=isch&q=Shinseiki+Evangelion+Movie%3A+Air%2FMagokoro+wo%2C+Kimi+ni+anime+official+key+visual,32,https://myanimelist.net/anime/32/Shinseiki_Evangelion_Movie__Air_Magokoro_wo_Kimi_ni,https://cdn.myanimelist.net/images/anime/1404/98182l.jpg,"Shinseiki Evangelion Movie: Air/Magokoro wo, Kimi ni",1
Shinsekai yori,Shinsekai yori,Shinsekai yori,1,"In the year 2011, a small percentage of humans began manifesting psychokinetic abilities known as ""Cantus."" Over a millennium later, in the small town of Kamisu 66, Saki Watanabe is the last of her friends to awaken her powers and join the Sage Academy, a school for psychics like her. Although everyone at the institution has Cantus, they are not all equal; shortly after Saki enrolls, one of her classmates who is regarded as being weaker than the others suddenly disappears.

Walking home one day with her friends—the determined Maria Akizuki, the intelligent Shun Aonuma, the observant Satoru Asahina, and the timid Mamoru Itou—she comes across two unfamiliar creatures known as ""Monster Rats."" These beings resemble moles and worship those with Cantus as gods. As a result, when Saki uses her abilities to save one from trouble, she is met with exceptional gratitude.

Now unsure about the Monster Rats' place in society, Saki and her friends find out about another disappearance. As time passes, they slowly look for answers to the mysteries that surround them and begin to realize that this seemingly ""perfect"" new world masks humanity's dark past.

[Written by MAL Rewrite]",Drama | Fantasy | Horror | Mystery | Sci-Fi | Suspense,Psychological,8.25,25,2012,A-1 Pictures,Shigeo Komori,,,Hauntingly dark and intellectually brilliant—a slow-burn dystopian mystery with a deeply unsettling emotional core.,IMDb user reviews (snippet synth),,https://www.google.com/search?tbm=isch&q=Shinsekai+yori+anime+official+key+visual,13125,https://myanimelist.net/anime/13125/Shinsekai_yori,https://cdn.myanimelist.net/images/anime/1549/136389l.jpg,Shinsekai yori,1
Shirobako,Shirobako,Shirobako,1,"It all started in Kaminoyama High School, when five best friends—Aoi Miyamori, Ema Yasuhara, Midori Imai, Shizuka Sakaki, and Misa Toudou—discovered their collective love for all things anime and formed the animation club. After making their first amateur anime together and showcasing it at the culture festival, the group vows to pursue careers in the industry, aiming to one day work together and create their own mainstream show.

Two and a half years later, Aoi and Ema have managed to land jobs at the illustrious Musashino Animation production company. The others, however, are finding it difficult to get their dream jobs. Shizuka is feeling the weight of not being recognized as a capable voice actor, Misa has a secure yet unsatisfying career designing 3D models for a car company, and Midori is a university student intent on pursuing her dream as a story writer. These five girls will learn that the path to success is one with many diversions, but dreams can still be achieved through perseverance and a touch of eccentric creativity.

[Written by MAL Rewrite]",Award Winning | Comedy | Drama,Adult Cast | Otaku Culture | Workplace,8.27,24,2014,P.A. Works,Shirō Hamaguchi,,,"Warm, authentic, and inspiring—an industry insider's love letter to animation; funny, stressful, and genuinely moving.",IMDb user reviews (snippet synth),,https://www.google.com/search?tbm=isch&q=Shirobako+anime+official+key+visual,25835,https://myanimelist.net/anime/25835/Shirobako,https://cdn.myanimelist.net/images/anime/1460/141897l.jpg,Shirobako,1
Shoujo Kakumei Utena,Shoujo Kakumei Utena,Shoujo Kakumei Utena,1,"Years ago, a tragic incident befell a young princess when both her parents died. Devastated, it seemed nothing would calm this poor soul. However, a prince traveling through the area came to see the princess, hoping to cheer her up. After wiping her sorrowful tears, the prince gave her a ring carrying a rose emblem and told her as long as she holds onto the ring, they are destined to meet again. The event leaves a deep impression on the girl, Utena Tenjou, leading her to become a prince herself. 

Years later, Utena attends Ootori Academy, recognized by the same rose emblem as her precious ring's. There, attracted by the scent of roses, she witnesses Anthy Himemiya tending the flowers, accompanied by the Student Council President Touga Kiryuu and Vice President Kyouichi Saionji, who seem to be arguing over Anthy. While Utena thinks nothing of the occurrence, the Student Council gathers to discuss an important matter. 

Subsequently, a misunderstanding leads to Utena being dragged into the world of Duelists—those with rings similar to her own. The Duelists fight for the ownership of the Rose Bride, Anthy Himemiya, who is said to possess great power. Wanting to prove her capabilities as a prince, and enraged that Anthy is being wronged and objectified, Utena resolves to fight against the Duelists to save her from the cruel fate.

[Written by MAL Rewrite]",Award Winning | Drama | Fantasy | Mystery | Suspense,Mahou Shoujo | Psychological | School,8.22,39,1997,J.C.Staff,"Shinkichi Mitsumune, [, a, ]",,,Dreamlike and revolutionary—a surreal feminist allegory with extraordinary visual ambition and emotional depth.,IMDb user reviews (snippet synth),,https://www.google.com/search?tbm=isch&q=Shoujo+Kakumei+Utena+anime+official+key+visual,440,https://myanimelist.net/anime/440/Shoujo_Kakumei_Utena,https://cdn.myanimelist.net/images/anime/1078/95285l.jpg,Shoujo Kakumei Utena,1
Shoujo Shuumatsu Ryokou,Shoujo Shuumatsu Ryokou,Shoujo Shuumatsu Ryokou,1,"Amid the desolate remains of a once-thriving city, only the rumbling of a motorbike breaks the cold winter silence. Its riders, Chito and Yuuri, are the last survivors in the war-torn city. Scavenging old military sites for food and parts, the two girls explore the wastelands and speculate about the old world to pass the time. Chito and Yuuri each occasionally struggle with the looming solitude, but when they have each other, sharing the weight of being two of the last humans becomes a bit more bearable. Between Yuuri's clumsy excitement and Chito's calm composure, their dark days get a little brighter with shooting practice, new books, and snowball fights on the frozen battlefield. 

Among a scenery of barren landscapes and deserted buildings, Shoujo Shuumatsu Ryokou tells the uplifting tale of two girls and their quest to find hope in a bleak and dying world.

[Written by MAL Rewrite]",Adventure | Mystery | Sci-Fi | Slice of Life,Iyashikei,8.23,12,2017,White Fox,Kenichiro Suehiro,,,Quietly profound—a post-apocalyptic journey that is both deeply peaceful and existentially haunting.,IMDb user reviews (snippet synth),,https://www.google.com/search?tbm=isch&q=Shoujo+Shuumatsu+Ryokou+anime+official+key+visual,35838,https://myanimelist.net/anime/35838/Shoujo_Shuumatsu_Ryokou,https://cdn.myanimelist.net/images/anime/12/88321l.jpg,Shoujo Shuumatsu Ryokou,1
Shoujo☆Kageki Revue Starlight,Shoujo☆Kageki Revue Starlight Movie,Shoujo☆Kageki Revue Starlight Movie,1,"With the arrival of a new generation of talented girls, another lively year at Seishou Music Academy begins. The graduating 99th class is already preparing for the much-anticipated rendition of Starlight, a bittersweet story about the parting of two girls.

It seems like all students in the Actor Training Department have their post-graduation future figured out—except for the cheerful Karen Aijou. Having fulfilled her promise of performing in a play with Hikari Kagura, her ambitious childhood friend, Karen struggles to find her purpose. What lies beyond their promise is a mystery to Karen, as Hikari was the fuel that kept her passion for performing aflame. Now alone, Karen must confront the reality of stage girls and find her way toward the future—her very own stage.

[Written by MAL Rewrite]",Drama,Music | Performing Arts | School,8.5,1,2021,Kinema Citrus,"Tatsuya Kato, Yoshiaki Fujisawa",,,Theatrical and surreal—a visually audacious musical fantasy praised for its emotional intelligence and dazzling stagecraft.,IMDb user reviews (snippet synth),,https://www.google.com/search?tbm=isch&q=Shoujo%E2%98%86Kageki+Revue+Starlight+anime+official+key+visual,35503,https://myanimelist.net/anime/35503/Shoujo☆Kageki_Revue_Starlight,https://cdn.myanimelist.net/images/anime/1165/93552l.jpg,Shoujo☆Kageki Revue Starlight,1
Shouwa Genroku Rakugo Shinjuu: Sukeroku Futatabi-hen,Shouwa Genroku Rakugo Shinjuu: Sukeroku Futatabi-hen,Shouwa Genroku Rakugo Shinjuu | Shouwa Genroku Rakugo Shinjuu: Sukeroku Futatabi-hen,2,"Even after having risen to the utmost rank of shin'uchi, Yotarou struggles to find his own identity in the world of rakugo. Caught between his master's teachings and the late Sukeroku's unique style, his performance lacks an important ingredient—ego. And while his popularity packs the theaters, he is but one of the few; rakugo is under threat of being eclipsed.

Meanwhile Yakumo, regarded by many as the last bastion of preserving the popularity of rakugo, struggles to cope with his elderly state. Even though his performances are still stellar, he fears that he is nearing his limits. His doubts grow stronger as an old friend creeps ever closer. Konatsu, for her part, attempts to raise her son as a single mother, which Yotarou is heavily opposed to. Instead, he seeks to persuade her to marry him and in turn raise her son as his own.

In Shouwa Genroku Rakugo Shinjuu: Sukeroku Futatabi-hen, the curtains fall on Yotarou and Yakumo's story, tasked with restoring the near-obsolete art form as well as overcoming their internal conflicts.

[Written by MAL Rewrite]",Drama,Adult Cast | Historical | Love Polygon | Performing Arts,8.7,12,2017,Studio Deen,Kana Shibue,,,Deeply moving and artistically magnificent—a theatrical swan song for a beloved story; profound and emotionally overwhelming.,IMDb user reviews (snippet synth),,https://www.google.com/search?tbm=isch&q=Shouwa+Genroku+Rakugo+Shinjuu%3A+Sukeroku+Futatabi-hen+anime+official+key+visual,33095,https://myanimelist.net/anime/33095/Shouwa_Genroku_Rakugo_Shinjuu__Sukeroku_Futatabi-hen,https://cdn.myanimelist.net/images/anime/1493/124765l.jpg,Shouwa Genroku Rakugo Shinjuu: Sukeroku Futatabi-hen,1
Slam Dunk,Slam Dunk,Slam Dunk,1,"Hanamichi Sakuragi, infamous for his temper, massive height, and fire-red hair, enrolls in Shohoku High, hoping to finally get a girlfriend and break his record of being rejected 50 consecutive times in middle school. His notoriety precedes him, however, leading to him being avoided by most students. Soon, after certain events, Hanamichi is left with two unwavering thoughts: ""I hate basketball,"" and ""I desperately need a girlfriend.""

One day, a girl named Haruko Akagi approaches him without any knowledge of his troublemaking ways and asks him if he likes basketball. Hanamichi immediately falls head over heels in love with her, blurting out a fervent affirmative. She then leads him to the gymnasium, where she asks him if he can do a slam dunk. In an attempt to impress Haruko, he makes the leap, but overshoots, instead slamming his head straight into the blackboard. When Haruko informs the basketball team's captain of Hanamichi's near-inhuman physical capabilities, he slowly finds himself drawn into the camaraderie and competition of the sport he had previously held resentment for.

[Written by MAL Rewrite]",Sports,School | Team Sports,8.55,101,1993,Toei Animation,Takahito Ito,,,Iconic and electric—the definitive basketball anime; fans recall it with overwhelming nostalgia and competitive excitement.,IMDb user reviews (snippet synth),,https://www.google.com/search?tbm=isch&q=Slam+Dunk+anime+official+key+visual,170,https://myanimelist.net/anime/170/Slam_Dunk,https://cdn.myanimelist.net/images/anime/12/86890l.jpg,Slam Dunk,1
Sono Bisque Doll wa Koi wo Suru,Sono Bisque Doll wa Koi wo Suru,Sono Bisque Doll wa Koi wo Suru,1,"High school student Wakana Gojou spends his days perfecting the art of making hina dolls, hoping to eventually reach his grandfather's level of expertise. While his fellow teenagers busy themselves with pop culture, Gojou finds bliss in sewing clothes for his dolls. Nonetheless, he goes to great lengths to keep his unique hobby a secret, as he believes that he would be ridiculed were it revealed. 

Enter Marin Kitagawa, an extraordinarily pretty girl whose confidence and poise are in stark contrast to Gojou's meekness. It would defy common sense for the friendless Gojou to mix with the likes of Kitagawa, who is always surrounded by her peers. However, the unimaginable happens when Kitagawa discovers Gojou's prowess with a sewing machine and brightly confesses to him about her own hobby: cosplay. Because her sewing skills are pitiable, she decides to enlist his help.

As Gojou and Kitagawa work together on one cosplay outfit after another, they cannot help but grow close—even though their lives are worlds apart.

[Written by MAL Rewrite]",Romance,Otaku Culture | School,8.15,12,2022,CloverWorks,Masaru Yokoyama,,,Sweet and surprisingly sincere—a cosplay romance praised for its genuine warmth and respectful portrayal of otaku culture.,IMDb user reviews (snippet synth),,https://www.google.com/search?tbm=isch&q=Sono+Bisque+Doll+wa+Koi+wo+Suru+anime+official+key+visual,48736,https://myanimelist.net/anime/48736/Sono_Bisque_Doll_wa_Koi_wo_Suru,https://cdn.myanimelist.net/images/anime/1179/119897l.jpg,Sono Bisque Doll wa Koi wo Suru,1
Sora yori mo Tooi Basho,Sora yori mo Tooi Basho,Sora yori mo Tooi Basho,1,"Filled with an overwhelming sense of wonder for the world around her, Mari Tamaki has always dreamt of what lies beyond the reaches of the universe. However, despite harboring such large aspirations on the inside, her fear of the unknown and anxiety over her own possible limitations have always held her back from chasing them. But now, in her second year of high school, Mari is more determined than ever to not let any more of her youth go to waste. Still, her fear continues to prevent her from taking that ambitious step forward—that is, until she has a chance encounter with a girl who has grand dreams of her own.

Spurred by her mother's disappearance, Shirase Kobuchizawa has been working hard to fund her trip to Antarctica. Despite facing doubt and ridicule from virtually everyone, Shirase is determined to embark on this expedition to search for her mother in a place further than the universe itself. Inspired by Shirase's resolve, Mari jumps at the chance to join her. Soon, their efforts attract the attention of the bubbly Hinata Miyake, who is eager to stand out, and Yuzuki Shiraishi, a polite girl from a high class background. Together, the four spirited girls set sail toward the frozen south, all in search of something great.

[Written by MAL Rewrite]",Adventure | Comedy | Drama,CGDCT,8.51,13,2018,Madhouse,Yoshiaki Fujisawa,,,Emotionally overwhelming and deeply inspiring—a journey to Antarctica that earns every tear; warm and triumphant.,IMDb user reviews (snippet synth),,https://www.google.com/search?tbm=isch&q=Sora+yori+mo+Tooi+Basho+anime+official+key+visual,35839,https://myanimelist.net/anime/35839/Sora_yori_mo_Tooi_Basho,https://cdn.myanimelist.net/images/anime/6/89879l.jpg,Sora yori mo Tooi Basho,1
Space☆Dandy,Space☆Dandy 2nd Season,Space☆Dandy 2nd Season,1,"Second season of Space Dandy.

Space Dandy is a dandy guy, in space! This dreamy adventurer with a to-die-for pompadour travels across the galaxy in search of aliens no one has ever laid eyes on. Each new species he discovers earns him a hefty reward, but this dandy has to be quick on his feet because it's first come, first served! Accompanied by his sidekicks, a rundown robot named QT and Meow the cat-looking space alien, Dandy bravely explores unknown worlds inhabited by a variety of aliens. Join the best dressed alien hunter in all of space and time as he embarks on an adventure that ends at the edge of the universe!

(Source: Bandai Visual)",Comedy | Sci-Fi,Adult Cast | Space,8.26,13,2014,Bones,Various Artists,,,Wildly inventive and joyfully anarchic—an anthology sci-fi comedy that revels in creative freedom and cool style.,IMDb user reviews (snippet synth),,https://www.google.com/search?tbm=isch&q=Space%E2%98%86Dandy+anime+official+key+visual,20057,https://myanimelist.net/anime/20057/Space☆Dandy,https://cdn.myanimelist.net/images/anime/4/56611l.jpg,Space☆Dandy,1
Spirited Away,Sen to Chihiro no Kamikakushi,Sen to Chihiro no Kamikakushi,1,"Stubborn, spoiled, and naïve, 10-year-old Chihiro Ogino is less than pleased when she and her parents discover an abandoned amusement park on the way to their new house. Cautiously venturing inside, she realizes that there is more to this place than meets the eye, as strange things begin to happen once dusk falls. Ghostly apparitions and food that turns her parents into pigs are just the start—Chihiro has unwittingly crossed over into the spirit world. Now trapped, she must summon the courage to live and work amongst spirits, with the help of the enigmatic Haku and the cast of unique characters she meets along the way.

Vivid and intriguing, Sen to Chihiro no Kamikakushi tells the story of Chihiro's journey through an unfamiliar world as she strives to save her parents and return home.

[Written by MAL Rewrite]",Adventure | Award Winning | Fantasy,Mythology,8.77,1,2001,Studio Ghibli,Joe Hisaishi,,,"magical, enchanting, and emotionally uplifting; dreamlike wonder with gentle coming-of-age warmth",IMDb user reviews (snippet synth),https://www.imdb.com/title/tt0245429/reviews/,https://www.google.com/search?tbm=isch&q=Spirited+Away+anime+official+key+visual,199,https://myanimelist.net/anime/199/Sen_to_Chihiro_no_Kamikakushi,https://cdn.myanimelist.net/images/anime/6/79597l.jpg,Taiyou no Mokushiroku: A Spirit of the Sun,0.2909
Spy x Family,Spy x Family,Spy x Family,1,"Corrupt politicians, frenzied nationalists, and other warmongering forces constantly jeopardize the thin veneer of peace between neighboring countries Ostania and Westalis. In spite of their plots, renowned spy and master of disguise ""Twilight"" fulfills dangerous missions one after another in the hope that no child will have to experience the horrors of war.

In the bustling Ostanian city of Berlint, Twilight dons the alias of ""Loid Forger,"" an esteemed psychiatrist. However, his true intention is to gather intelligence on prominent politician Donovan Desmond, who only appears rarely in public at his sons' school: the prestigious Eden Academy. Enlisting the help of unmarried city hall clerk Yor Briar to act as his wife and adopting the curious six-year-old orphan Anya as his daughter, Loid enacts his master plan. He will enroll Anya in Eden Academy, where Loid hopes she will excel and give him the opportunity to meet Donovan without arousing suspicion. 

Unfortunately for Loid, even a man of his talents has trouble playing the figure of a loving father and husband. And just like Loid is hiding his true identity, Yor—who is an underground assassin known as ""Thorn Princess""—and Anya—an esper who can read people's minds—have no plans to disclose their own secrets either. Although this picture-perfect family is founded on deception, the Forgers gradually come to understand that the love they share for one another trumps all else.

[Written by MAL Rewrite]",Action | Award Winning | Comedy,Childcare | Super Power,8.46,12,2022,Wit Studio | CloverWorks,Makoto Miyazaki,,,Charming and heartwarming—a found-family comedy with perfect comedic timing; irresistibly fun and wholesome.,IMDb user reviews (snippet synth),,https://www.google.com/search?tbm=isch&q=Spy+x+Family+anime+official+key+visual,50265,https://myanimelist.net/anime/50265/Spy_x_Family,https://cdn.myanimelist.net/images/anime/1441/122795l.jpg,Spy x Family,1
Stand By Me Doraemon 2,Stand By Me Doraemon 2,Stand By Me Doraemon 2,1,"After reminiscing about his late grandmother, Nobita Nobi wishes to see her again and asks Doraemon to return them to the past. Following the wholesome reunion of the two, Nobita's grandmother confesses that she hopes to meet his future bride. Nobita accepts her request out of filial love and quickly scrambles into the time machine as he and Doraemon journey forward in time.

However, when the duo warps to Nobita's wedding day, they discover that the future Nobita is missing from the ceremony! Determined to set things right, Doraemon and Nobita embark on a mission to search for Nobita's future self and encourage him to discover the happiness he deserves.

[Written by MAL Rewrite]",Comedy | Sci-Fi,Time Travel,8.19,1,2020,Shirogumi | Shin-Ei Animation,Naoki Satō,,,Warmly nostalgic and gently emotional—a sweet farewell for fans who grew up with Doraemon.,IMDb user reviews (snippet synth),,https://www.google.com/search?tbm=isch&q=Stand+By+Me+Doraemon+2+anime+official+key+visual,40853,https://myanimelist.net/anime/40853/Stand_By_Me_Doraemon_2,https://cdn.myanimelist.net/images/anime/1842/109657l.jpg,Stand By Me Doraemon 2,1
Steins;Gate,Steins;Gate,Steins;Gate | Steins;Gate 0 | Steins;Gate Movie: Fuka Ryouiki no Déjà vu | Steins;Gate: Kyoukaimenjou no Missing Link - Divide By Zero | Steins;Gate: Oukoubakko no Poriomania,5,"Eccentric scientist Rintarou Okabe has a never-ending thirst for scientific exploration. Together with his ditzy but well-meaning friend Mayuri Shiina and his roommate Itaru Hashida, Okabe founds the Future Gadget Laboratory in the hopes of creating technological innovations that baffle the human psyche. Despite claims of grandeur, the only notable ""gadget"" the trio have created is a microwave that has the mystifying power to turn bananas into green goo.

However, when Okabe attends a conference on time travel, he experiences a series of strange events that lead him to believe that there is more to the ""Phone Microwave"" gadget than meets the eye. Apparently able to send text messages into the past using the microwave, Okabe dabbles further with the ""time machine,"" attracting the ire and attention of the mysterious organization SERN.

Due to the novel discovery, Okabe and his friends find themselves in an ever-present danger. As he works to mitigate the damage his invention has caused to the timeline, Okabe fights a battle to not only save his loved ones but also to preserve his degrading sanity.

[Written by MAL Rewrite]",Drama | Sci-Fi | Suspense,Psychological | Time Travel,9.07,24,2011,White Fox,Takeshi Abo,,,mind-bending time-travel thriller that turns deeply emotional and romantic,IMDb user reviews (snippet synth),https://www.imdb.com/title/tt1910272/reviews/,https://www.google.com/search?tbm=isch&q=Steins%3BGate+anime+official+key+visual,9253,https://myanimelist.net/anime/9253/Steins_Gate,https://cdn.myanimelist.net/images/anime/1935/127974l.jpg,Steins;Gate,1
