title,title_original,merged_titles,n_entries_merged,synopsis,genres,themes,score,episodes,aired,studios,composer,composer_source_url,features,mood,mood_method,imdb_review_url,artwork,mal_id,mal_url,artwork_url,mal_title_matched,mal_match_score
Majo no Takkyuubin,Majo no Takkyuubin,Majo no Takkyuubin,1,"Kiki, a 13-year-old witch-in-training, must spend a year living on her own in a distant town in order to become a full-fledged witch. Leaving her family and friends, Kiki undertakes this tradition when she flies out into the open world atop her broomstick with her black cat Jiji.

As she settles down in the coastal town of Koriko, Kiki struggles to adapt and ends up wandering the streets with no place to stay—until she encounters Osono, who offers Kiki boarding in exchange for making deliveries for her small bakery. Before long, Kiki decides to open her own courier service by broomstick, beginning her journey to independence. In attempting to find her place among the townsfolk, Kiki brings with her exciting new experiences and comes to understand the true meaning of responsibility.

[Written by MAL Rewrite]",Adventure | Award Winning | Comedy | Drama | Fantasy,Iyashikei,8.23,1,1989,Studio Ghibli,Joe Hisaishi,,,"Warm and gently melancholic—Miyazaki's coming-of-age gem; cozy, charming, and quietly moving.",IMDb user reviews (snippet synth),,https://www.google.com/search?tbm=isch&q=Majo+no+Takkyuubin+anime+official+key+visual,512,https://myanimelist.net/anime/512/Majo_no_Takkyuubin,https://cdn.myanimelist.net/images/anime/1579/140483l.jpg,Majo no Takkyuubin,1
Major S1,Major S1,Major S1,1,"Gorou Honda, a little boy obsessed with baseball, has always admired his father, Shigeharu. Wishing to follow in his father's footsteps, Gorou dreams of becoming a professional baseball player. In turn, his son's starry-eyed admiration encourages Shigeharu to keep persevering, despite his late wife's death and his unsatisfying position on the second-string team Blue Ocean.

Unfortunately, an elbow injury forces Shigeharu off the team, and he falls into despair. However, after an offhand joke from his childhood friend, Shigeharu reevaluates his choices and decides to keep playing, leaving behind his prime position as pitcher and taking up the bat. Now motivated more than ever, Gorou works hard to carve his way in the Japanese Little League.

[Written by MAL Rewrite]",Sports,Team Sports,8.2,26,2004,Studio Hibari,Toshihiko Sahashi,,,Earnest and emotionally engaging—a long-form sports journey that builds real attachment to its hardheaded protagonist.,IMDb user reviews (snippet synth),,https://www.google.com/search?tbm=isch&q=Major+S1+anime+official+key+visual,627,https://myanimelist.net/anime/627/Major_S1,https://cdn.myanimelist.net/images/anime/13/73973l.jpg,Major S1,1
Major S2,Major S2,Major S2,1,"Gorou Honda has finally returned to Mifune East Junior High School, surprising his friends upon arrival. Now, Gorou is once again surrounded by those he holds closest, and he strives to continue playing and enjoying the game he loves most.

However, things do not go as planned, as Gorou is reminded of the harsh realities of baseball as he copes with an injury he sustained while playing baseball at Hitaka Little. Between new rivals, old friends, and mending broken relationships, Gorou must overcome challenges he has never faced before. 

His goal of attending elite baseball high school Kaido may not be far from his reach, but complicated circumstances may stop him in his tracks once again. How will he deal with the immense pressures of the game? And will he ever be able to find the type of baseball he loves most?

[Written by MAL Rewrite]",Sports,Team Sports,8.18,26,2005,Studio Hibari,Toshihiko Sahashi,,,Compelling and hard-fought—baseball drama at its most grounded; emotional and intensely competitive.,IMDb user reviews (snippet synth),,https://www.google.com/search?tbm=isch&q=Major+S2+anime+official+key+visual,558,https://myanimelist.net/anime/558/Major_S2,https://cdn.myanimelist.net/images/anime/6/73972l.jpg,Major S2,1
Major S3,Major S3,Major S3,1,"Having bid farewell to his former teammates at Kaido High School's baseball club, Gorou Honda returns to his hometown eager to continue playing. Attending a new high school proves to be more difficult than he initially expected, as Tetsufumi Egashira's merciless slandering of his name prevents Gorou from being accepted into any school with an existing baseball team. 

Left with no other options, Gorou joins Seishuu High School, where his childhood friend Kaoru Shimizu also attends. However, Seishuu has always been an all-girls school until two years ago, so there is not yet a dedicated men’s baseball team.

But nothing will stop Gorou in his pursuit of Koshien. He must now create a baseball team from scratch with the seven male students at Seishuu, but all of them are complete amateurs! He decides to train the incompetent team up to nationally competitive levels, but such a feat is easier said than done. Will Gorou once again perform miracles? Or will he give up on achieving his goal of defeating Kaido with his own team? 

[Written by MAL Rewrite]",Sports,Team Sports,8.21,26,2007,Studio Hibari,Toshihiko Sahashi,,,Tense and rewarding—Goro faces his biggest challenges yet; fans praise its honest portrayal of failure and growth.,IMDb user reviews (snippet synth),,https://www.google.com/search?tbm=isch&q=Major+S3+anime+official+key+visual,1842,https://myanimelist.net/anime/1842/Major_S3,https://cdn.myanimelist.net/images/anime/9/73971l.jpg,Major S3,1
Major S4,Major S4,Major S4,1,"Having finished high school, Gorou Honda sets his sights on becoming a professional baseball player. His dreams are much more ambitious than becoming a Japanese Baseball League player, so he instead decides to move to the birthplace of his beloved sport, America, in order to play in the Major League.

However, Gorou finds that the Major League players are much faster, stronger, and more driven than he is. Nonetheless, he is eager to catch up with them. In order to do so, Gorou must first conquer the ranks of the Minor League, where numerous skilled players compete in the grueling rise to the Majors.

Gorou learns that he will have to adapt to the stark differences of American culture and push himself to new extremes as his race to join the Major League begins.

[Written by MAL Rewrite]",Sports,Team Sports,8.18,26,2008,SynergySP,Noriyuki Asakura,,,Energizing and emotionally mature—a fresh setting in America adds new stakes to a beloved sports journey.,IMDb user reviews (snippet synth),,https://www.google.com/search?tbm=isch&q=Major+S4+anime+official+key+visual,3226,https://myanimelist.net/anime/3226/Major_S4,https://cdn.myanimelist.net/images/anime/9/75217l.jpg,Major S4,1
Major S5,Major S5,Major S5,1,"The Baseball World Cup is nearing, and Gorou Honda is eager to represent his country. However, one small problem stands in his way: the team roster has already been selected, and he is not a part of it. 

Nonetheless, Gorou remains adamant to join. He becomes a practice pitcher for the Japanese national team, hoping to demonstrate his incredible speed and skills to the team's manager. Fortunately, Gorou is given the chance to prove his worth: he must show an impressive performance in the upcoming practice match involving the veteran Japanese team and the young players who hope to replace them. 

The World Cup will bring together some of the strongest players from around the globe. It will also set the stage for Gorou's long-awaited showdown with his longtime rival, Joe Gibson.

[Written by MAL Rewrite]",Sports,Team Sports,8.39,25,2009,SynergySP,Noriyuki Asakura,,,Gritty and determined—the comeback arc resonates with fans; a deeply personal chapter in a sprawling saga.,IMDb user reviews (snippet synth),,https://www.google.com/search?tbm=isch&q=Major+S5+anime+official+key+visual,5028,https://myanimelist.net/anime/5028/Major_S5,https://cdn.myanimelist.net/images/anime/9/75218l.jpg,Major S5,1
Major S6,Major S6,Major S6,1,"The intense Baseball World Cup has reached its conclusion. Gorou Honda has regained his passion for baseball and is once again back in full gear. He has secured a team position with the Hornets and has travelled back to America to prepare for his spectacular debut as a Major League pitcher.

However, Gorou encounters a sudden series of unexpected issues and devastating events follow, crushing his motivation and potentially reducing the baseball career that he has worked tirelessly to maintain into crumbs. In the final season of Major, Gorou must yet again overcome immense hardship in order to save his baseball career. This time there is no simple solution, as the problem is deeply rooted within his own mind...

[Written by MAL Rewrite]",Sports,Team Sports,8.31,25,2010,SynergySP,Toshihiko Sahashi,,,Triumphant and bittersweet—the culmination of Goro's career; long-term fans describe an emotionally overwhelming experience.,IMDb user reviews (snippet synth),,https://www.google.com/search?tbm=isch&q=Major+S6+anime+official+key+visual,7655,https://myanimelist.net/anime/7655/Major_S6,https://cdn.myanimelist.net/images/anime/2/75216l.jpg,Major S6,1
Major: World Series,Major: World Series,Major: Message | Major: World Series,2,"Gorou Shigeno's journey with the Indiana Hornets continues as they seek to win the prestigious World Series. However, after an unexpected accident during the match with his fated rival, his quest in becoming the world's best becomes more challenging. Undaunted, Gorou continues to put the weight of his dreams into every pitch he makes, and forges a path towards his desired future through high-speed pitching.

[Written by MAL Rewrite]",Sports,Team Sports,8.28,2,2011,SynergySP,Toshihiko Sahashi,,,Climactic and deeply satisfying—the ultimate payoff for fans invested in Goro's lifelong baseball odyssey.,IMDb user reviews (snippet synth),,https://www.google.com/search?tbm=isch&q=Major%3A+World+Series+anime+official+key+visual,11917,https://myanimelist.net/anime/11917/Major__World_Series,https://cdn.myanimelist.net/images/anime/5/75220l.jpg,Major: World Series,1
March Comes in Like a Lion,3-gatsu no Lion 2nd Season,3-gatsu no Lion 2nd Season,1,"Now in his second year of high school, Rei Kiriyama continues pushing through his struggles in the professional shogi world as well as his personal life. Surrounded by vibrant personalities at the shogi hall, the school club, and in the local community, his solitary shell slowly begins to crack. Among them are the three Kawamoto sisters—Akari, Hinata, and Momo—who forge an affectionate and familial bond with Rei. Through these ties, he realizes that everyone is burdened by their own emotional hardships and begins learning how to rely on others while supporting them in return. 

Nonetheless, the life of a professional is not easy. Between tournaments, championships, and title matches, the pressure mounts as Rei advances through the ranks and encounters incredibly skilled opponents. As he manages his relationships with those who have grown close to him, the shogi player continues to search for the reason he plays the game that defines his career.

[Written by MAL Rewrite]",Drama,Childcare | Strategy Game,8.9,22,2017,Shaft,Yukari Hashimoto,,,"gentle, introspective character drama; deeply human healing arc with warmth, quiet melancholy, and uplifting growth.",IMDb user reviews (snippet synth),https://www.imdb.com/title/tt6074794/reviews/,https://www.google.com/search?tbm=isch&q=March+Comes+in+Like+a+Lion+anime+official+key+visual,31646,https://myanimelist.net/anime/31646/3-gatsu_no_Lion,https://cdn.myanimelist.net/images/anime/3/82899l.jpg,3-gatsu no Lion,0.3902
Medalist,Medalist,Medalist,1,"Tsukasa Akeuraji always dreamed of becoming a competitive solo figure skater, but starting too late in life meant his ambitions never got off the ground. Now barely scraping by, he takes on an assistant coach job, resigned to a future far from the one he once imagined.

Before his first day, Tsukasa meets Inori Yuitsuka, a shy fifth grader sneaking into the rink to practice. Captivated by figure skating, but held back by her mother's overprotectiveness and her own self-doubt, Inori has never been encouraged to pursue her passion until she encounters Tsukasa. Beneath her personality lies great potential, waiting to be unlocked with the right guidance.

Moved by Inori's determination to change and reminded of his own struggles, Tsukasa offers to coach and help her chase the dream she has been too afraid to voice. While the road ahead is long and filled with unfamiliar challenges and rival skaters, Inori dedicates herself to the art and strives to one day reach the Olympics and become a medalist. 

[Written by MAL Rewrite]",Drama | Sports,Performing Arts,8.38,13,2025,ENGI,Yuki Hayashi,,,Passionately felt—an underdog figure skating story praised for its authentic emotional tension and sincere storytelling.,IMDb user reviews (snippet synth),,https://www.google.com/search?tbm=isch&q=Medalist+anime+official+key+visual,55318,https://myanimelist.net/anime/55318/Medalist,https://cdn.myanimelist.net/images/anime/1029/146850l.jpg,Medalist,1
Meitantei Conan Movie 26: Kurogane no Submarine,Meitantei Conan Movie 26: Kurogane no Submarine,Meitantei Conan | Meitantei Conan Movie 06: Baker Street no Bourei | Meitantei Conan Movie 13: Shikkoku no Chaser | Meitantei Conan Movie 20: Junkoku no Nightmare | Meitantei Conan Movie 26: Kurogane no Submarine | Meitantei Conan: Episode One - Chiisaku Natta Meitantei,6,"This time's location is set in the sea near the Hachijo-jima island, Tokyo. Engineers from around the world have gathered for the full-scale operation of ""Pacific Buoy,"" an offshore facility to connect security cameras owned by the worldwide police forces. A test of a certain ""new technology"" based on a face recognition system is underway there.

Meanwhile, Conan and the Detective Boys visit Hachijo-jima at Sonoko's invitation and receive a phone call from Subaru Okiya informing them that a Europol employee was murdered in Germany by the Black Organization's Jin.

Conan, who is disquieted, sneaks into the facility and finds that a female engineer has been kidnapped by the Black Organization...! Furthermore, a USB drive containing certain information in her possession ends up in the hands of the organization... A black shadow also creeps up on Ai Haibara ...

(Source: Crunchyroll, edited)",Action | Mystery,Detective,8.35,1,2023,TMS Entertainment,"Yugo Kanno,  (soundtrack), Spitz,  (theme song: , ""Utsukushii Hire"", )",,,Slick and spectacular—a thrilling Conan blockbuster praised for its action set-pieces and submarine intrigue.,IMDb user reviews (snippet synth),,https://www.google.com/search?tbm=isch&q=Meitantei+Conan+Movie+26%3A+Kurogane+no+Submarine+anime+official+key+visual,53540,https://myanimelist.net/anime/53540/Meitantei_Conan_Movie_26__Kurogane_no_Submarine,https://cdn.myanimelist.net/images/anime/1138/133101l.jpg,Meitantei Conan Movie 26: Kurogane no Submarine,1
Mimi wo Sumaseba,Mimi wo Sumaseba,Mimi wo Sumaseba,1,"Shizuku Tsukishima is an energetic 14-year-old girl who enjoys reading and writing poetry in her free time. Glancing at the checkout cards of her books one evening, she notices that her library books are frequently checked out by a boy named Seiji Amasawa. Curiosity strikes Shizuku, and she decides to search for the boy who shares her love for literature.

Meeting a peculiar cat on the train, Shizuku follows the animal and is eventually led to a quaint antique shop, where she learns about a cat statuette known as ""The Baron."" Taking an interest in the shop, she surprisingly finds Seiji, and the two quickly befriend one another. Shizuku learns while acquainting herself with Seiji that he has a dream that he would like to fulfill, causing her dismay as she remains uncertain of her future and has yet to recognize her talents.

However, as her relationship with Seiji grows, Shizuku becomes determined to work toward a goal. Guided by the whispers of her heart and inspiration from The Baron, she resolves to carve out her own potential and dreams.

[Written by MAL Rewrite]",Drama | Romance,coming-of-age,8.22,1,1995,Studio Ghibli,Yuji Nomi,,,Warm and quietly beautiful—a charming coming-of-age romance that captures the tender anxieties of creative ambition.,IMDb user reviews (snippet synth),,https://www.google.com/search?tbm=isch&q=Mimi+wo+Sumaseba+anime+official+key+visual,585,https://myanimelist.net/anime/585/Mimi_wo_Sumaseba,https://cdn.myanimelist.net/images/anime/1764/138714l.jpg,Mimi wo Sumaseba,1
Mo Dao Zu Shi Q,Mo Dao Zu Shi Q,Mo Dao Zu Shi Q,1,"The cultivation classes in the Cloud Recesses have started, and Wei Wuxian is as mischievous as ever. From getting in trouble for cheating to tempting the ever-so-cold and stoic Lan Wangji into breaking one of the three thousand strict rules of the Gusu Lan Clan—he's done it all. Although almost everything Wei Wuxian does is against Lan Wangji's principles, an unbreakable bond forms between the two. 

This chibi spin-off is a refreshing compilation of the hilarious and adorable moments of Mo Dao Zu Shi that shows not only how impish Wei Wuxian can be, but also the bashful side of the icy Lan Wangji.

[Written by MAL Rewrite]",Comedy | Fantasy,Historical | Mythology | Reincarnation,8.19,30,2020,B.CMAY PICTURES,Yin Zheng,,,"Lighthearted and playful—a chibi comedy that fans enjoy as a sweet, low-stakes companion to the main series.",IMDb user reviews (snippet synth),,https://www.google.com/search?tbm=isch&q=Mo+Dao+Zu+Shi+Q+anime+official+key+visual,40435,https://myanimelist.net/anime/40435/Mo_Dao_Zu_Shi_Q,https://cdn.myanimelist.net/images/anime/1210/122883l.jpg,Mo Dao Zu Shi Q,1
Mo Dao Zu Shi: Final Season,Mo Dao Zu Shi: Wanjie Pian,Mo Dao Zu Shi | Mo Dao Zu Shi: Wanjie Pian | Mo Dao Zu Shi: Xian Yun Pian,3,"Along an empty road in the rural countryside, Wei Wuxian and Lan Wangji stumble across a stone plaque that reads ""Yi City."" Still on their quest to unravel the mystery behind the cursed severed arm, they venture into the deserted city to obtain further leads.

However, with the appearance of a mysterious new cultivator, the demonic arm investigation leads Wei Wuxian and Lan Wangji to a plot that threatens the cultivation world as they know it. The gravity of the new situation escalates when the two find it involves the chief cultivator of the renowned Lanling Jin Sect—Jin Guangyao.

As the pair continue to piece together the crucial conspiracies of the cultivation history, their friends and colleagues grow suspicious of their motives. With the world against him, Wei Wuxian must prove he is not the demonic sorcerer people believe him to be to regain their trust and save the cultivation world from the sinister evil lurking within it.

[Written by MAL Rewrite]",Action | Adventure | Drama | Fantasy | Mystery,Historical | Mythology | Reincarnation,8.68,12,2021,B.CMAY PICTURES,Yin Zheng,,,"Emotionally rich and beautifully animated—the conclusion fans waited for; tender, dramatic, and deeply satisfying.",IMDb user reviews (snippet synth),,https://www.google.com/search?tbm=isch&q=Mo+Dao+Zu+Shi%3A+Final+Season+anime+official+key+visual,38450,https://myanimelist.net/anime/38450/Mo_Dao_Zu_Shi__Xian_Yun_Pian,https://cdn.myanimelist.net/images/anime/1404/106707l.jpg,Mo Dao Zu Shi: Xian Yun Pian,0.6909
Mob Psycho 100,Mob Psycho 100 II,Mob Psycho 100 | Mob Psycho 100 II | Mob Psycho 100 III,3,"Shigeo ""Mob"" Kageyama is now maturing and understanding his role as a supernatural psychic that has the power to drastically affect the livelihood of others. He and his mentor Reigen Arataka continue to deal with supernatural requests from clients, whether it be exorcizing evil spirits or tackling urban legends that haunt the citizens.

While the workflow remains the same, Mob isn't just blindly following Reigen around anymore. With all his experiences as a ridiculously strong psychic, Mob's supernatural adventures now have more weight to them. Things take on a serious and darker tone as the dangers Mob and Reigen face are much more tangible and unsettling than ever before.

[Written by MAL Rewrite]",Action | Comedy | Supernatural,War,8.78,13,2019,Bones,Kenji Kawai,,,"heartwarming, hilarious, and hype; explosive action balanced by sincere growth and kindness",IMDb user reviews (snippet synth),https://www.imdb.com/title/tt5897304/reviews/,https://www.google.com/search?tbm=isch&q=Mob+Psycho+100+anime+official+key+visual,32182,https://myanimelist.net/anime/32182/Mob_Psycho_100,https://cdn.myanimelist.net/images/anime/8/80356l.jpg,Mob Psycho 100,1
Monogatari Series: Second Season,Monogatari Series: Second Season,Monogatari Series: Off & Monster Season | Monogatari Series: Second Season,2,"Apparitions, oddities, and gods continue to manifest around Koyomi Araragi and his close-knit group of friends: Tsubasa Hanekawa, the group's modest genius; Shinobu Oshino, the resident doughnut-loving vampire; athletic deviant Suruga Kanbaru; bite-happy spirit Mayoi Hachikuji; Koyomi's cute admirer Nadeko Sengoku; and Hitagi Senjougahara, Koyomi's eclectic girlfriend.

A new semester has begun and with graduation looming over Koyomi, he must quickly decide the paths he will walk, as well as the relationships he will form and friends that he will save. But as strange events begin to unfold, Koyomi is nowhere to be found, and a vicious tiger apparition has appeared in his absence. Hanekawa has become its target, and she quickly finds she must fend for herself.

[Written by MAL Rewrite]",Comedy | Mystery | Romance | Supernatural,Vampire,8.76,26,2013,Shaft,Satoru Kōsaki,,,"slow-burn psychological thriller; intricate, detail-rewarding mystery with constant tension, moral unease, and lingering dread.",IMDb user reviews (snippet synth),https://www.imdb.com/title/tt0434706/reviews/,https://www.google.com/search?tbm=isch&q=Monogatari+Series%3A+Second+Season+anime+official+key+visual,17074,https://myanimelist.net/anime/17074/Monogatari_Series__Second_Season,https://cdn.myanimelist.net/images/anime/1807/121534l.jpg,Monogatari Series: Second Season,1
Mononoke,Mononoke,Mononoke,1,"The ""Medicine Seller"" is a deadly and mysterious master of the occult who travels across feudal Japan in search of malevolent spirits called ""mononoke"" to slay. When he locates one of these spirits, he cannot simply kill it; he must first learn its Form, its Truth, and its Reason in order to wield the mighty Exorcism Sword and fight against it. He must begin  his strange exorcisms with intense psychological analysis and careful investigative work—an extremely dangerous step, as he must first confront and learn about the mononoke before he even has the means to defeat it.

The Medicine Seller's journey leads him to an old-fashioned inn where Shino, a pregnant woman, has finally found a place to rest. The owner has reluctantly placed her in the last vacant room; however, as she settles in, it quickly becomes clear that the room is infested by a lethal band of mononoke, the Zashiki Warashi. With his hunter's intuition, the Medicine Seller begins his investigation to discover the Form, the Truth, and the Reason before the Zashiki Warashi can kill again.

[Written by MAL Rewrite]",Horror | Mystery | Supernatural | Suspense,Adult Cast | Historical | Mythology | Psychological,8.41,12,2007,Toei Animation,Joe Hisaishi,,,"Hypnotic and unsettling—a visually dazzling psychological horror anthology; strange, gorgeous, and deeply unsettling.",IMDb user reviews (snippet synth),,https://www.google.com/search?tbm=isch&q=Mononoke+anime+official+key+visual,2246,https://myanimelist.net/anime/2246/Mononoke,https://cdn.myanimelist.net/images/anime/3/20713l.jpg,Mononoke,1
Mononoke Hime,Mononoke Hime,Mononoke Hime,1,"When an Emishi village is attacked by a fierce demon boar, the young prince Ashitaka puts his life at stake to defend his tribe. With its dying breath, the beast curses the prince's arm, granting him demonic powers while gradually siphoning his life away. Instructed by the village elders to travel westward for a cure, Ashitaka arrives at Tatara, the Iron Town, where he finds himself embroiled in a fierce conflict: Lady Eboshi of Tatara, promoting constant deforestation, stands against Princess San and the sacred spirits of the forest, who are furious at the destruction brought by the humans. As the opposing forces of nature and mankind begin to clash in a desperate struggle for survival, Ashitaka attempts to seek harmony between the two, all the while battling the latent demon inside of him. Princess Mononoke is a tale depicting the connection of technology and nature, while showing the path to harmony that could be achieved by mutual acceptance.

[Written by MAL Rewrite]",Action | Adventure | Award Winning | Fantasy,Historical | War,8.67,1,1997,Studio Ghibli,Joe Hisaishi,,,"Epic and profound—a morally complex environmental epic; tragic, beautiful, and awe-inspiring in scope.",IMDb user reviews (snippet synth),,https://www.google.com/search?tbm=isch&q=Mononoke+Hime+anime+official+key+visual,164,https://myanimelist.net/anime/164/Mononoke_Hime,https://cdn.myanimelist.net/images/anime/1355/147277l.jpg,Mononoke Hime,1
