title,title_original,merged_titles,n_entries_merged,synopsis,genres,themes,score,episodes,aired,studios,composer,composer_source_url,features,mood,mood_method,imdb_review_url,artwork,mal_id,mal_url,artwork_url,mal_title_matched,mal_match_score
86 Eighty-Six,86 Part 2,86 Part 2,1,"The disappearance of the Spearhead Squadron beyond the horizon does little to hide the intensity of the Republic of San Magnolia's endless propaganda. Vladilena Milizé continues to operate as ""Handler One,"" the commander of yet another dehumanized 86th faction's squadron in the continuous war against the Legion.

On the Western Front, Shinei Nouzen and his squad are quarantined in a military base controlled by the Federal Republic of Giad, formerly known as the Giadian Empire. The newly-established government grants the saved Eighty-Six full citizenship and freedom. Housed by the president Ernst Zimmerman himself, the group meets his adoptive daughter and the last Empress, Augusta Frederica Adel-Adler.

However, within the calm of this tender society, Shinei and his team feel that their purpose is on the battlefield. Before long, they are once again in the midst of the Legion's onslaught as a part of the Federacy's Nordlicht Squadron, accompanied by Augusta Frederica. But, as history repeats itself, they realize that no matter the side, death and pain on the front lines are the only comfort they know.

[Written by MAL Rewrite]",Action | Drama | Sci-Fi,Mecha | Military,8.72,12,2021,A-1 Pictures,"Hiroyuki Sawano, Kohta Yamamoto",,,"Bleak, tense war drama with political bite—emotionally heavy, character-driven, and steadily cathartic.",IMDb user reviews (snippet synth),https://www.imdb.com/title/tt13718450/reviews/,https://www.google.com/search?tbm=isch&q=86+Eighty-Six+anime+official+key+visual,48569,https://myanimelist.net/anime/48569/86_Part_2,https://cdn.myanimelist.net/images/anime/1321/117508l.jpg,86 Part 2,0.3636
A Silent Voice,Koe no Katachi,Koe no Katachi,1,"As a wild youth, elementary school student Shouya Ishida sought to beat boredom in the cruelest ways. When the deaf Shouko Nishimiya transfers into his class, Shouya and the rest of his class thoughtlessly bully her for fun. However, when her mother notifies the school, he is singled out and blamed for everything done to her. With Shouko transferring out of the school, Shouya is left at the mercy of his classmates. He is heartlessly ostracized all throughout elementary and middle school, while teachers turn a blind eye.

Now in his third year of high school, Shouya is still plagued by his wrongdoings as a young boy. Sincerely regretting his past actions, he sets out on a journey of redemption: to meet Shouko once more and make amends.

Koe no Katachi tells the heartwarming tale of Shouya's reunion with Shouko and his honest attempts to redeem himself, all while being continually haunted by the shadows of his past.
 
[Written by MAL Rewrite]",Award Winning | Drama,School,8.93,1,2016,Kyoto Animation,Kensuke Ushio,,,"Heartbreaking yet hopeful—viewers highlight its raw depiction of guilt, redemption, and emotional healing.",IMDb user reviews (snippet synth),https://www.imdb.com/title/tt5323662/reviews/,https://www.google.com/search?tbm=isch&q=A+Silent+Voice+anime+official+key+visual,28851,https://myanimelist.net/anime/28851/Koe_no_Katachi,https://cdn.myanimelist.net/images/anime/6/79634l.jpg,A silent voice,0.4324
Akira,Akira,Akira,1,"Japan, 1988. An explosion caused by a young boy with psychic powers tears through the city of Tokyo and ignites the fuse that leads to World War III. In order to prevent any further destruction, he is captured and taken into custody, never to be heard from again. Now, in the year 2019, a restored version of the city known as Neo-Tokyo—an area rife with gang violence and terrorism against the current government—stands in its place. Here, Shoutarou Kaneda leads ""the Capsules,"" a group of misfits known for riding large, custom motorcycles and being in constant conflict with their rivals ""the Clowns.""

During one of these battles, Shoutarou's best friend Tetsuo Shima is caught up in an accident with an esper who finds himself in the streets of Tokyo after escaping confinement from a government institution. Through this encounter, Tetsuo begins to develop his own mysterious abilities, as the government seeks to quarantine this latest psychic in a desperate attempt to prevent him from unleashing the destructive power that could once again bring the city to its knees.

[Written by MAL Rewrite]",Action | Horror | Sci-Fi,Gore | Military | Super Power,8.16,1,1988,Tokyo Movie Shinsha,Geinoh Yamashirogumi,,,"Visceral and overwhelming—a landmark in animated sci-fi; dark, chaotic, and haunting with unforgettable imagery.",IMDb user reviews (snippet synth),,https://www.google.com/search?tbm=isch&q=Akira+anime+official+key+visual,47,https://myanimelist.net/anime/47/Akira,https://cdn.myanimelist.net/images/anime/1408/114012l.jpg,Akira,1
Alien Stage,Alien Stage,Alien Stage,1,"Humans once lived like Earth was the center of the universe. Some people embraced religion and believed that God would deliver them from suffering. After humanity was enslaved by aliens, no one spoke of God any longer.

Now the grim truth is that humans are mere property of aliens. Recently, entering pet humans into the entertainment industry has become popular, and the biggest, most thrilling spectacle is known as Alien Stage. In this reality singing competition, alien sponsors flaunt their investments, while human contestants must battle to survive. No matter the relationship between opponents—whether it is love, hate, or something more extreme—only one victor can emerge each round.

[Written by MAL Rewrite]",Drama | Sci-Fi | Suspense,High Stakes Game | Music | Psychological,8.8,,2022,LICO,XENO VIBE; BL8M,https://alienstage.fandom.com/wiki/Sweet_Dream,,"painful, cruel, and bittersweet; tragic tension with a haunting aftertaste",IMDb user reviews (snippet synth),https://www.imdb.com/title/tt36378945/reviews/,https://www.google.com/search?tbm=isch&q=Alien+Stage+anime+official+key+visual,55255,https://myanimelist.net/anime/55255/Alien_Stage,https://cdn.myanimelist.net/images/anime/1524/143502l.jpg,Alien Stage,1
Ano Hi Mita Hana no Namae wo Bokutachi wa Mada Shiranai.,Ano Hi Mita Hana no Namae wo Bokutachi wa Mada Shiranai.,Ano Hi Mita Hana no Namae wo Bokutachi wa Mada Shiranai.,1,"Jinta Yadomi is peacefully living as a recluse, spending his days away from school and playing video games at home instead. One hot summer day, his childhood friend, Meiko ""Menma"" Honma, appears and pesters him to grant a forgotten wish. He pays her no mind, which annoys her, but he doesn't really care. After all, Menma already died years ago.

At first, Jinta thinks that he is merely hallucinating due to the summer heat, but he is later on convinced that what he sees truly is the ghost of Menma. Jinta and his group of childhood friends grew apart after her untimely death, but they are drawn together once more as they try to lay Menma's spirit to rest. Re-living their pain and guilt, will they be able to find the strength to help not only Menma move on—but themselves as well?

[Written by MAL Rewrite]",Drama | Supernatural,School,8.29,11,2011,A-1 Pictures,Remedios,,,"Bittersweet and tender—an emotionally crushing story about grief, guilt, and unresolved childhood bonds.",IMDb user reviews (snippet synth),,https://www.google.com/search?tbm=isch&q=Ano+Hi+Mita+Hana+no+Namae+wo+Bokutachi+wa+Mada+Shiranai.+anime+official+key+visual,9989,https://myanimelist.net/anime/9989/Ano_Hi_Mita_Hana_no_Namae_wo_Bokutachi_wa_Mada_Shiranai,https://cdn.myanimelist.net/images/anime/5/79697l.jpg,Ano Hi Mita Hana no Namae wo Bokutachi wa Mada Shiranai.,1
Ansatsu Kyoushitsu,Ansatsu Kyoushitsu 2nd Season,Ansatsu Kyoushitsu 2nd Season,1,"Returning from their summer vacation, the students of Class 3-E at the prestigious Kunugigaoka Middle School find themselves up against unbeatable odds. Faced with the possibility of world annihilation, the students must come up with increasingly elaborate and creative ways to kill their teacher, the cunning yet optimistic and helpful Koro-sensei.
 
However, eliminating Koro-sensei is not the only objective the students need to worry about. Gakuhou Asano, the academy's merciless and cruel principal, seeks to prevent Class 3-E's success by brainwashing his other hard-working pupils into ruthlessly competitive studying machines. Hostility begins to linger in the air as traitors and killers alike attempt to claim the bounty on Koro-sensei's head for themselves.
 
Nagisa Shiota, one of Class 3-E's most skilled assassins, finds himself in the middle of the conflict. While he works to maintain his academic standing and prevent the end of the world, domestic affairs jeopardize his place in Class 3-E. Together with his dedicated classmates, he must now face the threats head-on.

[Written by MAL Rewrite]",Action | Comedy,School,8.47,25,2016,Lerche,Tomoki Kikuya,,,Surprisingly heartfelt—starts as absurd comedy but builds genuine emotional warmth and bittersweet payoff.,IMDb user reviews (snippet synth),,https://www.google.com/search?tbm=isch&q=Ansatsu+Kyoushitsu+anime+official+key+visual,24833,https://myanimelist.net/anime/24833/Ansatsu_Kyoushitsu,https://cdn.myanimelist.net/images/anime/5/75639l.jpg,Ansatsu Kyoushitsu,1
Ao Ashi,Ao Ashi,Ao Ashi,1,"In a quiet rural town, the spotlight of a local junior high school football team rests on one player: Ashito Aoi. Known for his unpredictable moves and self-centered playing style, Ashito is the sole powerhouse pushing his team through an important high school preliminary tournament. However, their win streak is short-lived—an opponent causes Ashito to lose his temper and act violently, resulting in his removal from the rest of the game.

Without their star player, the team is quickly eliminated from the tournament. Just as he believes all hope is lost, Ashito is approached by a youth team coach named Tatsuya Fukuda who senses potential in him, and Fukuda invites him for tryouts in Tokyo. In an unfamiliar setting surrounded by talent, Ashito must bring out the best of his ability to prove himself and secure what could be a life-changing career.

[Written by MAL Rewrite]",Sports,Team Sports,8.16,24,2022,Production I.G,Masaru Yokoyama,,,"Grounded and inspiring sports drama—less flashy than typical soccer anime, praised for realistic tension and character growth.",IMDb user reviews (snippet synth),,https://www.google.com/search?tbm=isch&q=Ao+Ashi+anime+official+key+visual,49052,https://myanimelist.net/anime/49052/Ao_Ashi,https://cdn.myanimelist.net/images/anime/1731/120871l.jpg,Ao Ashi,1
Ao no Hako,Ao no Hako,Ao no Hako,1,"Every morning, incoming first-year Taiki Inomata hurries to his high school gym in order to further refine his badminton skills. However, his true motivation stems from sharing the otherwise empty gym with second-year Chinatsu Kano, Taiki's crush and the star player of the girls' basketball team. Although Chinatsu seems unapproachable, Taiki gradually finds opportunities to get to know her little by little.

Unbeknownst to Taiki, his tireless work ethic and admiration motivate Chinatsu to work harder and strive to achieve her greatest ambitions. When her family must suddenly move overseas for work, Chinatsu decides to remain in Japan and shoot for victory at the national level. With nowhere to stay, she is taken in by Taiki's mother, who is longtime friends with Chinatsu's own. Overwhelmed with the new reality of living alongside the girl he loves, Taiki resolves to join Chinatsu at the national level in his own sport—and grow closer to her in the process.

Still, despite being good enough to catch his coach's eye, Taiki must fight an uphill battle to qualify for a spot on the starting team. Cheered on by both Chinatsu and gymnast Hina Chouno, his childhood friend, Taiki aims to make a name for himself among his powerful upperclassmen.

[Written by MAL Rewrite]",Romance | Sports,Love Polygon | School | Team Sports,8.21,25,2024,Telecom Animation Film,Takashi Ohmama,,,"Sweet and nervous—a gentle, slow-burn romance wrapped in sports, charming in its awkward sincerity.",IMDb user reviews (snippet synth),,https://www.google.com/search?tbm=isch&q=Ao+no+Hako+anime+official+key+visual,57181,https://myanimelist.net/anime/57181/Ao_no_Hako,https://cdn.myanimelist.net/images/anime/1496/147108l.jpg,Ao no Hako,1
Aria the Natural,Aria the Natural,Aria the Natural,1,"Akari Mizunashi continues her training to become a Prima Undine (a professional tour guide gondolier) along with her friends Aika and Alice in the peaceful city of Neo Venezia. Despite the fact that these three girls are from competing companies, they are constantly together, learning more about how to become better tour guides and more about the mysteries of Neo Venezia.

As the group continues to meet interesting and unforgettable people through their daily routines, they will also come closer to the secrets that make the enigmatic and ever beautiful city of Neo Venezia so warm and alive.

Welcome back to Neo Venezia: the city where miracles can be created by hand.

[Written by MAL Rewrite]",Sci-Fi | Slice of Life,Iyashikei,8.16,26,2006,HAL Film Maker,Choro Club feat. Senoo,,,"Deeply calming and quietly beautiful—a slice of life that feels like a warm, slow afternoon on the water.",IMDb user reviews (snippet synth),,https://www.google.com/search?tbm=isch&q=Aria+the+Natural+anime+official+key+visual,962,https://myanimelist.net/anime/962/Aria_the_Natural,https://cdn.myanimelist.net/images/anime/2/77621l.jpg,Aria the Natural,1
Aria the Origination,Aria the Origination,Aria the Origination,1,"In the 24th century on the planet Aqua, three girls—Akari Mizunashi, Alice Carroll, and Aika S. Granzchesta—continue to work hard toward achieving their goal of becoming Prima Undines: professional tour guide gondoliers. Luckily, the girls have the guidance of the three best Prima Undines in Neo-Venezia—Alicia Florence, Athena Glory, and Akira E. Ferrari—who are known as the ""Water Fairies"" in honor of their skill. With their help, the young apprentices train hard and work to overcome any situations that they find themselves in.

Aria The Origination follows the hardships and daily lives of these three young girls, who are doing their best to improve as tour gondoliers in Neo-Venezia, a terraformed replica of Venice.

[Written by MAL Rewrite]",Sci-Fi | Slice of Life,Iyashikei,8.47,13,2008,HAL Film Maker,Choro Club feat. Senoo,,,Bittersweet and luminous—a graceful farewell to a beloved world; peaceful yet emotionally resonant.,IMDb user reviews (snippet synth),,https://www.google.com/search?tbm=isch&q=Aria+the+Origination+anime+official+key+visual,3297,https://myanimelist.net/anime/3297/Aria_the_Origination,https://cdn.myanimelist.net/images/anime/1431/132867l.jpg,Aria the Origination,1
Asobi Asobase,Asobi Asobase,Asobi Asobase,1,"During recess, Olivia, a foreign transfer student who doesn't know English, plays a game of ""look-the-other-way"" with Hanako Honda, a loud-mouthed airhead. Their rowdy behavior spurs the ire of Kasumi Nomura, a deadpan loner constantly teased by her older sister for her tendency to lose games. Not willing to compete, Kasumi declines Olivia's offer to join the fun, but eventually gets involved anyway and dispenses her own brand of mischief. Soon, a strange friendship blossoms between the peculiar trio, and they decide to form the ""Pastime Club,"" where they are free to resume their daily hijinks. 

Whether it be failing to learn English, trying desperately to become popular, or getting caught by teachers at the wrong time, school life will never be boring when the girls of Asobi Asobase are up to their hilarious antics.

[Written by MAL Rewrite]",Comedy,Gag Humor | School,8.19,12,2018,Lerche,Masato Koda,,,Chaotic and unhinged—absurdist humor with sudden horror gags; wildly funny in its unpredictability.,IMDb user reviews (snippet synth),,https://www.google.com/search?tbm=isch&q=Asobi+Asobase+anime+official+key+visual,37171,https://myanimelist.net/anime/37171/Asobi_Asobase,https://cdn.myanimelist.net/images/anime/1139/95077l.jpg,Asobi Asobase,1
Attack on Titan,Shingeki no Kyojin Season 3 Part 2,Shingeki no Kyojin Movie: Kanketsu-hen - The Last Attack | Shingeki no Kyojin Season 3 Part 2 | Shingeki no Kyojin: Kuinaki Sentaku | Shingeki no Kyojin: The Final Season | Shingeki no Kyojin: The Final Season - Kanketsu-hen,5,"Seeking to restore humanity's diminishing hope, the Survey Corps embark on a mission to retake Wall Maria, where the battle against the merciless ""Titans"" takes the stage once again.

Returning to the tattered Shiganshina District that was once his home, Eren Yeager and the Corps find the town oddly unoccupied by Titans. Even after the outer gate is plugged, they strangely encounter no opposition. The mission progresses smoothly until Armin Arlert, highly suspicious of the enemy's absence, discovers distressing signs of a potential scheme against them. 

Shingeki no Kyojin Season 3 Part 2 follows Eren as he vows to take back everything that was once his. Alongside him, the Survey Corps strive—through countless sacrifices—to carve a path towards victory and uncover the secrets locked away in the Yeager family's basement.

[Written by MAL Rewrite]",Action | Drama | Suspense,Gore | Military | Survival,9.05,10,2019,Wit Studio,Hiroyuki Sawano,,,"Dark, brutal, and emotionally exhausting—celebrated for its intensity, moral ambiguity, and shocking twists.",IMDb user reviews (snippet synth),https://www.imdb.com/title/tt2560140/reviews/,https://www.google.com/search?tbm=isch&q=Attack+on+Titan+anime+official+key+visual,16498,https://myanimelist.net/anime/16498/Shingeki_no_Kyojin,https://cdn.myanimelist.net/images/anime/10/47347l.jpg,Shingeki no Kyojin,0.2424
Baccano!,Baccano!,Baccano!,1,"During the early 1930s in Chicago, the transcontinental train, Flying Pussyfoot, is starting its legendary journey that will leave a trail of blood all over the country. At the same time in New York, the ambitious scientist Szilard and his unwilling aide Ennis are looking for missing bottles of the immortality elixir. In addition, a war between the mafia groups is getting worse. On board the Advena Avis, in 1711, alchemists are about to learn the price of immortality.

Based on the award-winning light novels of the same name, Baccano! follows several events that initially seem unrelated, both in time and place, but are part of a much bigger story—one of alchemy, survival, and immortality. Merging these events together are the kindhearted would-be thieves, Isaac and Miria, connecting various people, all of them with their own hidden ambitions and agendas, and creating lifelong bonds and consequences for everyone involved.

[Written by MAL Rewrite]",Action | Mystery | Supernatural,Adult Cast | Historical | Organized Crime,8.35,13,2007,Brain's Base,Makoto Yoshimori,,,"Kinetic and exhilarating—a non-linear crime thriller dripping with style, sharp wit, and dark humor.",IMDb user reviews (snippet synth),,https://www.google.com/search?tbm=isch&q=Baccano%21+anime+official+key+visual,2251,https://myanimelist.net/anime/2251/Baccano,https://cdn.myanimelist.net/images/anime/3/14547l.jpg,Baccano!,1
Bakemono no Ko,Bakemono no Ko,Bakemono no Ko,1,"Two souls, living very different lives, wander alone and isolated in their respective worlds. For nine-year-old Ren, the last person who treated him with any form of kindness has been killed, and he is shunned by what is left of his family. With no parents, no real family, and no place to go, Ren escapes into the confusing streets and alleyways of Shibuya. Through the twists and turns of the alleys, Ren stumbles into the intimidating Kumatetsu, who leads him to the beast realm of Shibuten.

For Kumatetsu, the boy represents a chance for him to become a candidate to replace the lord of the realm once he retires. While nearly unmatched in combat, Kumatetsu's chilly persona leaves him with no disciples to teach and no way to prove he is worthy of becoming the lord's successor. 

While the two share different goals, they agree to help each other in order to reach them. Kumatetsu searches for recognition; Ren, now known as Kyuuta, searches for the home he never had. As the years pass by, it starts to become apparent that the two are helping each other in more ways than they had originally thought. Perhaps there has always been less of a difference between them, a boy and a beast, than either of the two ever realized.

[Written by MAL Rewrite]",Fantasy,Anthropomorphic | Isekai,8.23,1,2015,Studio Chizu,Masakatsu Takagi,,,Warm and adventurous—an emotionally satisfying coming-of-age fantasy with a gruff but tender heart.,IMDb user reviews (snippet synth),,https://www.google.com/search?tbm=isch&q=Bakemono+no+Ko+anime+official+key+visual,28805,https://myanimelist.net/anime/28805/Bakemono_no_Ko,https://cdn.myanimelist.net/images/anime/11/73540l.jpg,Bakemono no Ko,1
Bakemonogatari,Bakemonogatari,Bakemonogatari,1,"Koyomi Araragi, a third-year high school student, manages to survive a vampire attack with the help of Meme Oshino, a strange man residing in an abandoned building. Though being saved from vampirism and now a human again, several side effects such as superhuman healing abilities and enhanced vision still remain. Regardless, Araragi tries to live the life of a normal student, with the help of his friend and the class president, Tsubasa Hanekawa.

When fellow classmate Hitagi Senjougahara falls down the stairs and is caught by Araragi, the boy realizes that the girl is unnaturally weightless. Despite Senjougahara's protests, Araragi insists he help her, deciding to enlist the aid of Oshino, the very man who had once helped him with his own predicament.

Through several tales involving demons and gods, Bakemonogatari follows Araragi as he attempts to help those who suffer from supernatural maladies.

[Written by MAL Rewrite]",Mystery | Romance | Supernatural,Vampire,8.32,15,2009,Shaft,Satoru Kōsaki,,,Clever and unsettling—dialogue-heavy psychological mystery with an electric visual style; cerebral and seductive.,IMDb user reviews (snippet synth),,https://www.google.com/search?tbm=isch&q=Bakemonogatari+anime+official+key+visual,5081,https://myanimelist.net/anime/5081/Bakemonogatari,https://cdn.myanimelist.net/images/anime/11/75274l.jpg,Bakemonogatari,1
Bakuman.,Bakuman. 3rd Season,Bakuman. 3rd Season,1,"Onto their third serialization, manga duo Moritaka Mashiro and Akito Takagi—also known by their pen name, Muto Ashirogi—are ever closer to their dream of an anime adaption. However, the real challenge is only just beginning: if they are unable to compete with the artist Eiji Niizuma in the rankings within the span of six months, they will be canceled. To top it off, numerous rivals are close behind and declaring war. They don't even have enough time to spare thinking about an anime!

In Bakuman. 3rd Season, Muto Ashirogi must find a way to stay atop the colossal mountain known as the Shounen Jack rankings. With new problems and new assistants, the pair continue to strive for their dream.

[Written by MAL Rewrite]",Comedy | Drama | Romance,Otaku Culture,8.52,25,2012,J.C.Staff,"Takayuki Negishi, Neil Parfitt",,,"Earnest and motivating—a love letter to manga creation; warm, competitive, and surprisingly moving.",IMDb user reviews (snippet synth),,https://www.google.com/search?tbm=isch&q=Bakuman.+anime+official+key+visual,7674,https://myanimelist.net/anime/7674/Bakuman,https://cdn.myanimelist.net/images/anime/6/26138l.jpg,Bakuman.,1
Ballroom e Youkoso,Ballroom e Youkoso,Ballroom e Youkoso,1,"Tatara Fujita is a shy middle schooler who has no particular plan for the future. He has gotten through life by avoiding any kind of confrontation and blending in with the crowd. But blending in isn't enough to get out of trouble, as some bullies harass him for money. Luckily, he is saved by a man named Kaname Sengoku.

Kaname invites Tatara to his dance studio. Although he would normally never set foot in such a place, Tatara is captivated by Sengoku's commanding presence. Granted an opportunity to dance with fellow classmate Shizuku Hanaoka—who often practices at the studio—Tatara realizes there's something about the idea of being put in the limelight and dancing where people will see him that keeps him coming back. With an earnest, passionate drive to improve, Tatara begins his journey into the world of competitive dance.

[Written by MAL Rewrite]",Sports,Performing Arts,8.18,24,2017,Production I.G,Yuki Hayashi,,,"Electrifying and tense—competitive dance rendered as raw, passionate combat; dramatic and physically charged.",IMDb user reviews (snippet synth),,https://www.google.com/search?tbm=isch&q=Ballroom+e+Youkoso+anime+official+key+visual,34636,https://myanimelist.net/anime/34636/Ballroom_e_Youkoso,https://cdn.myanimelist.net/images/anime/5/86739l.jpg,Ballroom e Youkoso,1
